{
  "schema_version": "1.0.0",
  "run_id": "20260825-172222-backtest-spec-dh01",
  "policy_version": "dividend-hurdle-core20-2026-08-25-draft-v1",
  "run_purpose": "MECHANISM_TEST",
  "scenario": "BASE",
  "account_id": "backtest-demo-core20",
  "as_of": "2026-06-10T15:00:00+08:00",
  "valuation_cutoff": "2026-06-10T15:00:00+08:00",
  "currency": "CNY",
  "run_status": "CHECKPOINT",
  "account_summary": {
    "cumulative_external_contributions_cny": 10010.0,
    "cumulative_external_withdrawals_cny": 0.0,
    "net_external_contributions_cny": 10010.0,
    "cumulative_buy_gross_cny": 10000.0,
    "cumulative_buy_transaction_costs_cny": 10.0,
    "cumulative_sell_gross_cny": 0.0,
    "cumulative_sell_transaction_costs_cny": 0.0,
    "cumulative_dividend_gross_cny": 0.0,
    "cumulative_dividend_tax_cny": 0.0,
    "cash_cny": 0.0,
    "dividend_receivable_cny": 200.0,
    "other_receivables_cny": 0.0,
    "liabilities_cny": 0.0,
    "market_value_cny": 10500.0,
    "total_assets_cny": 10700.0,
    "equity_cny": 10700.0,
    "active_position_count": 1,
    "maximum_position_count": 20,
    "vacant_slot_count": 19,
    "unresolved_valuation_count": 0
  },
  "performance": {
    "realized_pnl_cny": 0.0,
    "unrealized_pnl_cny": 690.0,
    "total_pnl_cny": 690.0,
    "simple_return": 0.06893106893106893,
    "mwrr_xirr_annualized": null,
    "twr_cumulative": null,
    "maximum_drawdown": null,
    "calculation_status": "PARTIAL"
  },
  "security_ledgers": [
    {
      "symbol": "601288",
      "exchange": "SSE",
      "name": "农业银行",
      "ownership_type": "CENTRAL_SOE",
      "position_state": "OPEN",
      "current_episode_id": "601288-episode-001",
      "original_entry_target_shares": 1000,
      "current_quantity": 1000,
      "sellable_quantity": 1000,
      "cumulative_external_contribution_attributed_cny": 10010.0,
      "cumulative_buy_gross_cny": 10000.0,
      "cumulative_buy_transaction_costs_cny": 10.0,
      "cumulative_buy_cost_including_fees_cny": 10010.0,
      "cumulative_sell_gross_cny": 0.0,
      "cumulative_sell_transaction_costs_cny": 0.0,
      "cumulative_net_sell_proceeds_cny": 0.0,
      "cumulative_dividend_gross_cny": 0.0,
      "cumulative_dividend_tax_cny": 0.0,
      "cumulative_net_dividends_cny": 0.0,
      "current_dividend_receivable_cny": 200.0,
      "current_cost_basis_cny": 10010.0,
      "current_raw_price_cny": 10.5,
      "price_as_of": "2026-06-10T15:00:00+08:00",
      "current_market_value_cny": 10500.0,
      "valuation_status": "CURRENT",
      "last_observable_reference_value_cny": 10500.0,
      "last_observable_reference_at": "2026-06-10T15:00:00+08:00",
      "lifecycle_value_cny": 10700.0,
      "realized_pnl_cny": 0.0,
      "unrealized_pnl_cny": 690.0,
      "total_pnl_cny": 690.0,
      "operation_count": 5,
      "operations": [
        {
          "event_id": "evt-entry-signal-001",
          "episode_id": "601288-episode-001",
          "event_type": "ENTRY_SIGNAL",
          "status": "RECORDED",
          "signal_at": "2026-01-05T15:00:00+08:00",
          "occurred_at": "2026-01-05T15:00:00+08:00",
          "known_at": "2026-01-05T15:00:00+08:00",
          "side": "BUY",
          "quantity_delta": 0,
          "cash_delta_cny": 0.0,
          "price_cny": 10.0,
          "gross_amount_cny": null,
          "cost_breakdown": {
            "broker_commission_cny": 0.0,
            "stamp_duty_cny": 0.0,
            "transfer_fee_cny": 0.0,
            "exchange_and_regulatory_fees_cny": 0.0,
            "other_cash_fees_cny": 0.0,
            "dividend_tax_cny": 0.0,
            "cash_transaction_costs_cny": 0.0,
            "slippage_attribution_cny": 0.0
          },
          "resulting_quantity": 0,
          "signal_snapshot": {
            "d_ttm_cny_per_share": 0.5,
            "d_med3_cny_per_share": 0.5,
            "d_cons_cny_per_share": 0.5,
            "raw_close_cny": 10.0,
            "dividend_yield": 0.05,
            "cd_signal_rate": 0.018,
            "cd_tenor_years": 5,
            "cd_rate_quality": "OBSERVED",
            "hurdle_rate": 0.048,
            "yield_buffer": 0.002,
            "maximum_buy_price_cny": 10.416666666666666
          },
          "reason": "质量门通过且税前保守股息率不低于门槛。",
          "evidence_ids": ["ev-dividend-demo", "ev-cd-rate-demo", "ev-close-demo"]
        },
        {
          "event_id": "evt-contribution-001",
          "episode_id": "601288-episode-001",
          "event_type": "CONTRIBUTION_ATTRIBUTION",
          "status": "RECORDED",
          "signal_at": "2026-01-05T15:00:00+08:00",
          "occurred_at": "2026-01-06T09:29:00+08:00",
          "known_at": "2026-01-06T09:29:00+08:00",
          "side": null,
          "quantity_delta": 0,
          "cash_delta_cny": 10010.0,
          "price_cny": null,
          "gross_amount_cny": 10010.0,
          "cost_breakdown": {
            "broker_commission_cny": 0.0,
            "stamp_duty_cny": 0.0,
            "transfer_fee_cny": 0.0,
            "exchange_and_regulatory_fees_cny": 0.0,
            "other_cash_fees_cny": 0.0,
            "dividend_tax_cny": 0.0,
            "cash_transaction_costs_cny": 0.0,
            "slippage_attribution_cny": 0.0
          },
          "resulting_quantity": 0,
          "signal_snapshot": null,
          "reason": "共享现金不足，按本次成交总支出精确补足。",
          "evidence_ids": ["evt-entry-signal-001"]
        },
        {
          "event_id": "evt-buy-fill-001",
          "episode_id": "601288-episode-001",
          "event_type": "BUY_FILL",
          "status": "FILLED",
          "signal_at": "2026-01-05T15:00:00+08:00",
          "occurred_at": "2026-01-06T09:30:00+08:00",
          "known_at": "2026-01-06T09:30:00+08:00",
          "side": "BUY",
          "quantity_delta": 1000,
          "cash_delta_cny": -10010.0,
          "price_cny": 10.0,
          "gross_amount_cny": 10000.0,
          "cost_breakdown": {
            "broker_commission_cny": 10.0,
            "stamp_duty_cny": 0.0,
            "transfer_fee_cny": 0.0,
            "exchange_and_regulatory_fees_cny": 0.0,
            "other_cash_fees_cny": 0.0,
            "dividend_tax_cny": 0.0,
            "cash_transaction_costs_cny": 10.0,
            "slippage_attribution_cny": 0.0
          },
          "resulting_quantity": 1000,
          "signal_snapshot": null,
          "reason": "下一可交易日开盘价格与滑点未超过预先确定的限价。",
          "evidence_ids": ["ev-open-demo", "evt-entry-signal-001"]
        },
        {
          "event_id": "evt-dividend-receivable-001",
          "episode_id": "601288-episode-001",
          "event_type": "DIVIDEND_RECEIVABLE",
          "status": "RECORDED",
          "signal_at": null,
          "occurred_at": "2026-06-10T09:00:00+08:00",
          "known_at": "2026-06-10T09:00:00+08:00",
          "side": null,
          "quantity_delta": 0,
          "cash_delta_cny": 0.0,
          "price_cny": null,
          "gross_amount_cny": 200.0,
          "cost_breakdown": {
            "broker_commission_cny": 0.0,
            "stamp_duty_cny": 0.0,
            "transfer_fee_cny": 0.0,
            "exchange_and_regulatory_fees_cny": 0.0,
            "other_cash_fees_cny": 0.0,
            "dividend_tax_cny": 0.0,
            "cash_transaction_costs_cny": 0.0,
            "slippage_attribution_cny": 0.0
          },
          "resulting_quantity": 1000,
          "signal_snapshot": null,
          "reason": "除权日确认每股 0.20 元现金分红应收，尚未到派息日。",
          "evidence_ids": ["ev-dividend-implementation-demo"]
        },
        {
          "event_id": "evt-valuation-001",
          "episode_id": "601288-episode-001",
          "event_type": "VALUATION",
          "status": "RECORDED",
          "signal_at": null,
          "occurred_at": "2026-06-10T15:00:00+08:00",
          "known_at": "2026-06-10T15:00:00+08:00",
          "side": null,
          "quantity_delta": 0,
          "cash_delta_cny": 0.0,
          "price_cny": 10.5,
          "gross_amount_cny": null,
          "cost_breakdown": {
            "broker_commission_cny": 0.0,
            "stamp_duty_cny": 0.0,
            "transfer_fee_cny": 0.0,
            "exchange_and_regulatory_fees_cny": 0.0,
            "other_cash_fees_cny": 0.0,
            "dividend_tax_cny": 0.0,
            "cash_transaction_costs_cny": 0.0,
            "slippage_attribution_cny": 0.0
          },
          "resulting_quantity": 1000,
          "signal_snapshot": null,
          "reason": "按数据截止时点的未复权收盘价估值。",
          "evidence_ids": ["ev-close-valuation-demo"]
        }
      ]
    }
  ],
  "account_cash_flows": [
    {
      "flow_id": "flow-contribution-001",
      "occurred_at": "2026-01-06T09:29:00+08:00",
      "flow_type": "CONTRIBUTION",
      "amount_cny": 10010.0,
      "caused_by_operation_id": "evt-contribution-001",
      "attributed_symbol": "601288"
    }
  ],
  "reconciliation": {
    "status": "PASS",
    "tolerance_cny": 0.01,
    "checks": [
      {
        "name": "CASH_ROLLFORWARD",
        "status": "PASS",
        "difference": 0.0,
        "unit": "CNY",
        "formula": "0 + 10010 - 10000 - 10 = 0"
      },
      {
        "name": "POSITION_QUANTITY",
        "status": "PASS",
        "difference": 0.0,
        "unit": "SHARES",
        "formula": "0 + 1000 - 0 + 0 = 1000"
      },
      {
        "name": "ASSET_EQUITY",
        "status": "PASS",
        "difference": 0.0,
        "unit": "CNY",
        "formula": "0 + 200 + 10500 - 0 = 10700"
      },
      {
        "name": "TOTAL_PNL",
        "status": "PASS",
        "difference": 0.0,
        "unit": "CNY",
        "formula": "10700 + 0 - 10010 = 690"
      },
      {
        "name": "SECURITY_SUBLEDGER_SUM",
        "status": "PASS",
        "difference": 0.0,
        "unit": "CNY",
        "formula": "10700 - 10010 = 690"
      }
    ]
  },
  "data_quality": {
    "status": "VALID",
    "raw_data_mode": "TEST_FIXTURE",
    "synthetic_raw_observation_count": 3,
    "modeled_execution_assumption_count": 1,